<?xml version="1.0" encoding="utf-8"?>
<!DOCTYPE module SYSTEM "../openwebsoccer.dtd">

<!---
    * This file is part of OpenWebSoccer-Sim.
    *
    * OpenWebSoccer-Sim is free software: you can redistribute it
    * and/or modify it under the terms of the
    * GNU Lesser General Public License
    * as published by the Free Software Foundation, either version 3 of
    * the License, or any later version.
    *
    * OpenWebSoccer-Sim is distributed in the hope that it will be
    * useful, but WITHOUT ANY WARRANTY; without even the implied
    * warranty of MERCHANTABILITY or FITNESS FOR A PARTICULAR PURPOSE.
    * See the GNU Lesser General Public License for more details.
    *
    * You should have received a copy of the GNU Lesser General Public
    * License along with OpenWebSoccer-Sim.
    * If not, see
    <http://www.gnu.org/licenses/>.
-->

<module version="OpenWebsoccer">
    <settings>
        <setting id="sofortcom_enabled" category="premium" type="boolean" default="false"/>
        <setting id="sofortcom_configkey" category="premium" type="text" default=""/>
    </settings>

    <actions>
        <action id="sofortcom-notify" controller="SofortComPaymentNotificationController" role="guest,user">
            <param id="u" type="number" required="true"/>
        </action>

        <action id="sofortcom-redirect" controller="SofortComRedirectController" role="user">
            <param id="amount" type="number" required="true" min="1"/>
        </action>
    </actions>

    <blocks>
        <block
                id="sofortcompaymentlink"
                template="sofortcompaymentlink"
                includepages="premium-feature-requested"
                area="content_bottom"
                weight="1"
                role="user"/>
    </blocks>
</module>
