<?xml version="1.0" encoding="ISO-8859-1"?>
<!DOCTYPE module SYSTEM "../openwebsoccer.dtd">
<!---
*
* This file is part of OpenWebSoccer-Sim.
*
* OpenWebSoccer-Sim is free software: you can redistribute it
* and/or modify it under the terms of the
* GNU Lesser General Public License
* as published by the Free Software Foundation, either version 3 of
* the License, or any later version.
*
* OpenWebSoccer-Sim is distributed in the hope that it will be
* useful, but WITHOUT ANY WARRANTY; without even the implied
* warranty of MERCHANTABILITY or FITNESS FOR A PARTICULAR PURPOSE.
* See the GNU Lesser General Public License for more details.
*
* You should have received a copy of the GNU Lesser General Public
* License along with OpenWebSoccer-Sim.
* If not, see <http://www.gnu.org/licenses/>.
*
* Author: Ingo Hofmann
* Base Version: OpenWebSoccer-Sim 5.2.4-Snapshot vom 21. Juni 2015
*
* This Version called "OpenWebsoccer" is a advanced modification
* by Rolf Joseph / ErdemCan 2015 - 2016
*
* For comparison of the code look at the original at
* https://github.com/ihofmann/open-websoccer
-->
<module version="OpenWebsoccer">
	<messages>
		<message id="settings_tab_frontend">Frontend</message>
		<message id="imprint_navlabel">Impressum</message>
		<message id="imprint_label_content">Seiteninhalt</message>
		<message id="imprint_label_content_help">HTML ist erlaubt. Zeilenumbrüche werden automatisch umgewandelt.</message>
		<message id="imprint_introduction">In der Regel ist es aus rechtlichen Gründen erforderlich, den verantwortlichen Webseitenbetreiber auf der Webseite öffentlich anzugeben. Tragen Sie dazu die Kontaktdaten des Seitenbetreibers unten ein. Sie erscheinen auf der Webseite unter "Impressum".</message>
		<message id="imprint_validationerror_content">Es muss ein Inhalt angegeben werden.</message>
		<message id="settings_label_head_code">HTML-Code für den &lt;head&gt;-Bereich</message>
	</messages>
</module>
