<?xml version="1.0" encoding="utf-8"?>
<!DOCTYPE module SYSTEM "../openwebsoccer.dtd">

<!---
    * This file is part of OpenWebSoccer-Sim.
    *
    * OpenWebSoccer-Sim is free software: you can redistribute it
    * and/or modify it under the terms of the
    * GNU Lesser General Public License
    * as published by the Free Software Foundation, either version 3 of
    * the License, or any later version.
    *
    * OpenWebSoccer-Sim is distributed in the hope that it will be
    * useful, but WITHOUT ANY WARRANTY; without even the implied
    * warranty of MERCHANTABILITY or FITNESS FOR A PARTICULAR PURPOSE.
    * See the GNU Lesser General Public License for more details.
    *
    * You should have received a copy of the GNU Lesser General Public
    * License along with OpenWebSoccer-Sim.
    * If not, see
    <http://www.gnu.org/licenses/>.
-->

<module version="OpenWebsoccer">
    <settings>
        <setting id="facebook_enable_login" category="social" type="boolean" default="0"/>
        <setting id="facebook_appid" category="social" type="text" default=""/>
        <setting id="facebook_appsecret" category="social" type="text" default=""/>
        <setting id="facebook_enable_comments" category="social" type="boolean" default="0"/>
        <setting id="facebook_enable_likebutton" category="social" type="boolean" default="0"/>
    </settings>

    <blocks>
        <block
                id="facebook-login-sidebar"
                template="facebookloginbox"
                model="FacebookLoginModel"
                includepages="all"
                area="sidebar"
                weight="1"
                role="guest"/>
        <block
                id="facebook-like"
                template="facebook_like"
                includepages="home,news-details,match,todaysmatches,highscore,freeclubs"
                area="content_bottom"
                weight="5"
                role="guest,user"/>
        <block
                id="facebook-sdk"
                template="facebook_sdk"
                includepages="all"
                area="content_top"
                weight="0"
                role="guest,user"/>
        <block
                id="facebook-comments"
                template="facebook_comments"
                includepages="news-details,match"
                area="content_bottom"
                weight="10"
                role="guest,user"/>
    </blocks>

    <actions>
        <action id="facebook-login" controller="FacebookLoginController" role="guest,user">
            <param id="error" type="text" required="false"/>
        </action>

        <action id="facebook-logout" controller="FacebookLogoutController" role="user,guest"/>
    </actions>
</module>
