<?xml version="1.0" encoding="utf-8"?>
<!DOCTYPE module SYSTEM "../openwebsoccer.dtd">

<!---
    * This file is part of OpenWebSoccer-Sim.
    *
    * OpenWebSoccer-Sim is free software: you can redistribute it
    * and/or modify it under the terms of the
    * GNU Lesser General Public License
    * as published by the Free Software Foundation, either version 3 of
    * the License, or any later version.
    *
    * OpenWebSoccer-Sim is distributed in the hope that it will be
    * useful, but WITHOUT ANY WARRANTY; without even the implied
    * warranty of MERCHANTABILITY or FITNESS FOR A PARTICULAR PURPOSE.
    * See the GNU Lesser General Public License for more details.
    *
    * You should have received a copy of the GNU Lesser General Public
    * License along with OpenWebSoccer-Sim.
    * If not, see
    <http://www.gnu.org/licenses/>.
-->

<module version="OpenWebsoccer">
    <settings>
        <setting id="micropayment_enabled" category="premium" type="boolean" default="false"/>
        <setting id="micropayment_project" category="premium" type="text" default=""/>
        <setting id="micropayment_accesskey" category="premium" type="text" default=""/>
        <setting id="micropayment_call2pay_enabled" category="premium" type="boolean" default="false"/>
        <setting id="micropayment_handypay_enabled" category="premium" type="boolean" default="false"/>
        <setting id="micropayment_ebank2pay_enabled" category="premium" type="boolean" default="false"/>
        <setting id="micropayment_creditcard_enabled" category="premium" type="boolean" default="false"/>
    </settings>

    <actions>
        <action id="micropayment-redirect" controller="MicropaymentRedirectController" role="user">
            <param id="amount" type="number" required="true"/>
        </action>
    </actions>

    <blocks>
        <block
                id="micropaymentlink"
                template="micropaymentlink"
                includepages="premium-feature-requested"
                area="content_bottom"
                weight="1"
                role="user"/>
    </blocks>
</module>
