<?xml version="1.0" encoding="ISO-8859-1"?>
<!DOCTYPE module SYSTEM "../openwebsoccer.dtd">
<!---
*
* This file is part of OpenWebSoccer-Sim.
*
* OpenWebSoccer-Sim is free software: you can redistribute it
* and/or modify it under the terms of the
* GNU Lesser General Public License
* as published by the Free Software Foundation, either version 3 of
* the License, or any later version.
*
* OpenWebSoccer-Sim is distributed in the hope that it will be
* useful, but WITHOUT ANY WARRANTY; without even the implied
* warranty of MERCHANTABILITY or FITNESS FOR A PARTICULAR PURPOSE.
* See the GNU Lesser General Public License for more details.
*
* You should have received a copy of the GNU Lesser General Public
* License along with OpenWebSoccer-Sim.
* If not, see <http://www.gnu.org/licenses/>.
*
* Author: Ingo Hofmann
* Base Version: OpenWebSoccer-Sim 5.2.3 - 2015
*
* This Version called "OpenWebsoccer" is a advanced modification
* by Rolf Joseph / ErdemCan 2015 - 2016
*
* For comparison of the code look at the original at
* https://github.com/ihofmann/open-websoccer
-->
<module version="OpenWebsoccer">
	<messages>
		<message id="upload-clublogo_navlabel">Neues Vereinslogo hochladen</message>
		<message id="upload-clublogo_intro">Sie können hier ein PNG- oder JPEG-Bild hochladen. Es muss <strong>rechteckig</strong> sein mit einer Mindestbreite von <strong>120 Pixel</strong> und einer maximalen Dateigrösse von <strong>%d KBytes</strong>.</message>
		<message id="upload-clublogo_success">Das neue Vereinslogo wurde erfolgreich hochgeladen!</message>
		<message id="activitylog_upload-club-picture">%s hat ein neues Vereinslogo hochgeladen.</message>
	</messages>
</module>
