<?xml version="1.0" encoding="utf-8"?>
<!DOCTYPE module SYSTEM "../openwebsoccer.dtd">

<!---
    * This file is part of OpenWebSoccer-Sim.
    *
    * OpenWebSoccer-Sim is free software: you can redistribute it
    * and/or modify it under the terms of the
    * GNU Lesser General Public License
    * as published by the Free Software Foundation, either version 3 of
    * the License, or any later version.
    *
    * OpenWebSoccer-Sim is distributed in the hope that it will be
    * useful, but WITHOUT ANY WARRANTY; without even the implied
    * warranty of MERCHANTABILITY or FITNESS FOR A PARTICULAR PURPOSE.
    * See the GNU Lesser General Public License for more details.
    *
    * You should have received a copy of the GNU Lesser General Public
    * License along with OpenWebSoccer-Sim.
    * If not, see
    <http://www.gnu.org/licenses/>.
-->

<module version="OpenWebsoccer">
    <messages>
        <message id="facebooklogin_failure">Die Anmeldung über Facebook wurde abgebrochen.</message>
        <message id="facebooklogin_success">Erfolgreich über Facebook angemeldet!</message>
        <message id="facebook_login_button">Über Facebook anmelden</message>
        <message id="facebooklogout_failure">Sie konnten nicht abgemeldet werden! Probieren Sie es noch einmal.
        </message>
        <message id="facebooklogout_success">Erfolgreich abgemeldet!</message>
        <message id="facebooklogout_success_details">Bitte beachten Sie, dass Sie aus Sicherheitsgründen auch aus
            Facebook abgemeldet wurden.
        </message>
    </messages>
</module>
